{
  "decision": {
    "status": "needs_confirmation",
    "owner_team": "Payments",
    "owner_pillar": "Core Platform",
    "owner_theme": "Checkout",
    "confidence": 0.62,
    "reasoning_summary": "Payment-related endpoint and service signals are present, but evidence is split across adjacent services."
  },
  "classification": {
    "issue_type": "bug",
    "incident_gate_triggered": false,
    "incident_gate_reason": null
  },
  "evidence": [
    {
      "source_type": "apiv3_db",
      "source_ref": "https://eventbrite.atlassian.net/wiki/spaces/PLAT/database/17319100531",
      "matched_on": "endpoint",
      "matched_value": "/v3/orders/checkout/",
      "weight": 0.45
    },
    {
      "source_type": "services_db",
      "source_ref": "https://eventbrite.atlassian.net/wiki/spaces/PLAT/database/17319362720",
      "matched_on": "service",
      "matched_value": "payments-orchestrator",
      "weight": 0.35
    },
    {
      "source_type": "services_db",
      "source_ref": "https://eventbrite.atlassian.net/wiki/spaces/PLAT/database/17319362720",
      "matched_on": "service",
      "matched_value": "checkout-service",
      "weight": 0.35
    }
  ],
  "candidates": [
    {
      "team": "Payments",
      "score": 0.62,
      "why": "Strong checkout evidence with partial contradiction across neighboring services."
    },
    {
      "team": "Checkout Experience",
      "score": 0.58,
      "why": "Service overlap suggests possible alternate owner."
    }
  ],
  "actions": {
    "routing_recommendation": {
      "project": "EB",
      "team_field": "Payments",
      "component": null
    },
    "ambiguity_resolution": {
      "required": true,
      "channel": "#help-service-catalog",
      "message_template": "Hypothesis: this belongs to Payments because checkout endpoint and payment orchestration evidence are strongest. Could you confirm/correct ownership? If incorrect, what is the right owner so we can update the ownership map?"
    },
    "map_update_needed": true
  }
}
